<?xml version="1.0" encoding="UTF-8"?>
<!DOCTYPE personas SYSTEM "./AC5.9.2.dtd">
<personas>
    <persona>
        <dni>25866513G</dni>
        <nombre>Marta</nombre>
        <apellidos>Castoña Arieta</apellidos>
        <domicilio>
            <localidad>Icod</localidad>
            <calle>Santa María</calle>
            <numero>2</numero>
            <tipo>Vivienda</tipo>
        </domicilio>
    </persona>
    <persona>
        <dni>45223565F</dni>
        <nombre>Antonio</nombre>
        <apellidos>García Villarán</apellidos>
        <domicilio>
            <localidad>Adeje</localidad>
            <calle>La Gomera</calle>
            <numero>25</numero>
            <tipo>Edificio</tipo>
        </domicilio>
    </persona>
</personas>